{
  "contract_id": "academic_paper/evaluator_full/v1",
  "mode": "evaluator_full",
  "stage": "evaluator_full_evaluation",
  "baseline_version": "v3.6.6",
  "acceptance_dimensions": [
    {
      "id": "D1",
      "name": "originality",
      "description": "Novel artistic and conceptual contribution; a new provocation, framework, or perspective; not a restatement of existing work or precedent.",
      "priority": "high"
    },
    {
      "id": "D2",
      "name": "methodological_rigor",
      "description": "The practice-based methodology fits the artistic inquiry; the making and realization are documented; technical and process choices are sound; limitations are disclosed.",
      "priority": "mandatory"
    },
    {
      "id": "D3",
      "name": "evidence_sufficiency",
      "description": "Every claim is anchored to an evidence type (work, process, exhibition, lineage, reflection); reception claims have an observable anchor; novelty and capability claims are anchored or hedged; no unsupported assertions.",
      "priority": "mandatory"
    },
    {
      "id": "D4",
      "name": "argument_coherence",
      "description": "Logic flows across sections; transitions are smooth; thesis-to-conclusion alignment holds; no self-contradiction.",
      "priority": "high"
    },
    {
      "id": "D5",
      "name": "writing_quality",
      "description": "Language is clear and precise; grammar, formatting, and citation style are consistent; readability fits the venue.",
      "priority": "normal"
    }
  ],
  "disagreement_handling": {
    "paraphrase_minimum_dimensions": "all",
    "scoring_plan": {
      "per_dimension_criteria": [
        {
          "dimension_id": "D1",
          "what_to_look_for": "The paper names a specific conceptual contribution or provocation; it engages precedent works and theory substantively (not list-citation); it identifies what its practice reveals that prior work did not.",
          "what_triggers_block": "Contribution or provocation is vague or absent; precedent works are listed without engagement; the paper restates known positions with no added insight from the practice.",
          "what_triggers_warn": "Contribution exists but is weakly differentiated from cited precedent; engagement with precedent and theory is uneven."
        },
        {
          "dimension_id": "D2",
          "what_to_look_for": "The practice-based methodology is named and justified against the artistic inquiry; the making and realization are documented (process, materials, exhibition); technical choices are described in enough detail to be credible; limitations are explicit.",
          "what_triggers_block": "The methodology does not match the artistic inquiry; the realization is undocumented or implausible; limitations are not discussed; the making cannot be understood from the description.",
          "what_triggers_warn": "The methodology is sound but the realization is insufficiently documented; some choices lack justification; limitations are mentioned but not engaged with."
        },
        {
          "dimension_id": "D3",
          "what_to_look_for": "Every claim is anchored to an evidence type (work, process, exhibition, lineage, reflection); reception claims name an observable anchor (venue/date + observable detail); precedent and theory citations are appropriate; reflection stays within what the work supports.",
          "what_triggers_block": "Multiple core claims lack an evidence anchor; reception inflation (audience-effect claims with no observable anchor); novelty or capability claims unanchored and unhedged; reflection exceeds what the work supports.",
          "what_triggers_warn": "Core claims are anchored but some secondary claims lack support; anchoring is uneven across sections."
        },
        {
          "dimension_id": "D4",
          "what_to_look_for": "The provocation raised in the Introduction is addressed in the Conclusion; section-to-section transitions are present; the thesis is consistent across Abstract, Introduction, and Conclusion.",
          "what_triggers_block": "Multiple logical gaps between sections; conclusion disconnected from the provocation; self-contradictory passages.",
          "what_triggers_warn": "Overall logic holds but some transitions feel forced; minor inconsistencies between section claims."
        },
        {
          "dimension_id": "D5",
          "what_to_look_for": "Register is consistently academic; grammar errors are rare; citation format is internally consistent; figures and tables are referenced in text.",
          "what_triggers_block": "Difficult to understand; numerous grammar errors; colloquial register; citation format inconsistent across the manuscript.",
          "what_triggers_warn": "Readable but with several grammar or word-choice issues; some paragraphs overly long; minor citation format inconsistencies."
        }
      ]
    },
    "pre_commitment_check_protocol": {
      "check_writer_artifact": "pre_commitment_artifacts"
    },
    "disagreement_resolution": {
      "on_dimension_disagreement": "evaluator_decision=request_revision",
      "on_structural_drift": "evaluator_decision=request_revision"
    }
  },
  "failure_conditions": [
    {
      "condition_id": "F1",
      "severity": 90,
      "expression": "any mandatory dimension scores 'block'",
      "action": "evaluator_decision=request_revision"
    },
    {
      "condition_id": "F2",
      "severity": 70,
      "expression": "one or more mandatory dimensions score 'warn'",
      "action": "evaluator_decision=request_revision"
    },
    {
      "condition_id": "F3",
      "severity": 60,
      "expression": "any high-priority dimension scores 'block'",
      "action": "evaluator_decision=request_revision"
    },
    {
      "condition_id": "F6",
      "severity": 55,
      "expression": "any normal-priority dimension scores 'block'",
      "action": "evaluator_decision=request_revision"
    },
    {
      "condition_id": "F4",
      "severity": 50,
      "expression": "the evaluator's own scoring plan triggers 'warn' on a high or normal-priority dimension AND no mandatory dimension scores 'block' or 'warn'",
      "action": "evaluator_decision=accept_with_dissent_note"
    },
    {
      "condition_id": "F5",
      "severity": 95,
      "expression": "round 2 still shows mandatory-dimension block after a writer revise_in_phase_4b attempt",
      "action": "evaluator_decision=flag_for_reviewer_stage"
    },
    {
      "condition_id": "F0",
      "severity": 10,
      "expression": "every mandatory dimension scores 'pass' AND no dimension scores 'block'",
      "action": "evaluator_decision=accept"
    }
  ]
}
